id,guid,link,pubdate,author,title,description,source,user_id,profile_image_url,user_statuses_count,user_friends_count,user_followers_count,user_created_at,user_bio,user_location,lang,
237,"https://twitter.com/NikenParamitha5/statuses/1189123516789972993","https://twitter.com/NikenParamitha5/statuses/1189123516789972993","2019-10-29 06:15:13","NikenParamitha5","Semenjak Pak @Prabowo msuk kabnet @Jokowi | Kadal Gurun makin kesulitan mrusak NKRI melalui racun Khilafah ISIS mrka #RadikalKepanasan #RadikalKepanasan","Semenjak Pak @Prabowo msuk kabnet @Jokowi | Kadal Gurun makin kesulitan mrusak NKRI melalui racun Khilafah ISIS mrka #RadikalKepanasan #RadikalKepanasan","TweetCaster",940424911696289792,"https://pbs.twimg.com/profile_images/1166246853764976640/76DsR7IV_normal.png",63,126,36,"2017-12-11 22:35:46","Dealova 💌","Yogyakarta, Indonesia","in","","","","","","","","","","","","","","","","","","",
238,"https://twitter.com/nilaambara87/statuses/1189123473425096704","https://twitter.com/nilaambara87/statuses/1189123473425096704","2019-10-29 06:15:03","nilaambara87","RT @Kata_Hatiku88: Pesan Dari Bapak @prabowo Nich Khususnya Untuk Anak-Anak Muda Indonesia.....""  👉Klo kamu tidak bisa Berbuat Banyak Berbu…","Pesan Dari Bapak @prabowo Nich Khususnya Untuk Anak-Anak Muda Indonesia.....""  👉Klo kamu tidak bisa Berbuat Banyak Berbuat Sedikit, Klo tidak Bisa Berbuat Sedikit\'pun JANGAN BERBUAT RUSAK !!!!"" https://t.co/yffIkW6AMc","Twitter for Android",947753098923073536,"https://pbs.twimg.com/profile_images/1179633896230490115/Xt7-3OT7_normal.jpg",11691,444,444,"2018-01-01 03:55:21","tugas kita berjuang bukan menang dn saya bangga tidak di barisan yg curang","Puri, Indonesia","in","","","","","","","","","","","","","","","","","","",
239,"https://twitter.com/saefudin_zuhrii/statuses/1189123449911824385","https://twitter.com/saefudin_zuhrii/statuses/1189123449911824385","2019-10-29 06:14:57","saefudin_zuhrii","@Spectator210 @conan_idn @prabowo @Dahnilanzar Sue","@Spectator210 @conan_idn @prabowo @Dahnilanzar Sue","Twitter for Android",2954701555,"https://pbs.twimg.com/profile_images/1174659231972085760/rn7nQyEr_normal.jpg",13955,201,166,"2015-01-01 05:45:46","Pemerintah kalau banyak d kritik berarti banyak yg merhatiin bnyk yg sayang ,, yg penting gk baperan aja 🙃,  retweet bukan berarti setuju cuman biar nganu aja","khayalan","und","","","","","","","","","","","","","","","","","","",
240,"https://twitter.com/Rio_Ramabaskara/statuses/1189123282282283008","https://twitter.com/Rio_Ramabaskara/statuses/1189123282282283008","2019-10-29 06:14:17","Rio_Ramabaskara","Tugas BUMN Melayani, Bukan Kejar Laba, gitu lho pak @prabowo https://t.co/9mYO7IR9fj","Tugas BUMN Melayani, Bukan Kejar Laba, gitu lho pak @prabowo https://t.co/9mYO7IR9fj","Twitter for iPhone",380761087,"https://pbs.twimg.com/profile_images/1181854982770835456/qgJm17f__normal.jpg",118531,1005,22405,"2011-09-27 01:42:13","Netizen | Advokat | Rakyat Indonesia - Penikmat Lagu-lagu @sheilaOn7","Jakarta Capital Region","in","","","","","","","","","","","","","","","","","","",
241,"https://twitter.com/kandayan/statuses/1189123243115827200","https://twitter.com/kandayan/statuses/1189123243115827200","2019-10-29 06:14:08","kandayan","Mentri itu ibarat kendaraan adalah cuma bemper, dan @prabowo diposisikan saling berhadapan untuk berbenturan, dan dipertontonkan kepada rakyat. Dalam politik tidak ada musuh abadi, yang ada demi kepentingan calo.","Mentri itu ibarat kendaraan adalah cuma bemper, dan @prabowo diposisikan saling berhadapan untuk berbenturan, dan dipertontonkan kepada rakyat. Dalam politik tidak ada musuh abadi, yang ada demi kepentingan calo.","Twitter for Android",229405934,"https://pbs.twimg.com/profile_images/1149935459209867264/HQYYPISl_normal.jpg",13266,256,266,"2010-12-22 04:37:38","I  Y  P  I  N # berempati kepada saudara kita yang belum beruntung itu lebih baik daripada menyalahkan, karena kebenaran sesungguhnya milik NYA","Jakarta 13220","in","","","","","","","","","","","","","","","","","","",
242,"https://twitter.com/Lily21670477/statuses/1189123231489253376","https://twitter.com/Lily21670477/statuses/1189123231489253376","2019-10-29 06:14:05","Lily21670477","@Gerindra @prabowo Salut bt bpk..mobil dll kyy g pnting bt aku,yg pnting kerjanya...","@Gerindra @prabowo Salut bt bpk..mobil dll kyy g pnting bt aku,yg pnting kerjanya...","Twitter for Android",1130951087060541440,"https://pbs.twimg.com/profile_images/1163261445477244928/Qv6i3wiU_normal.jpg",732,220,183,"2019-05-21 17:38:46","akun kedua ni gaess..😑","DKI Jakarta, Indonesia","in","","","","","","","","","","","","","","","","","","",
243,"https://twitter.com/HerlyansahEdria/statuses/1189123181195325440","https://twitter.com/HerlyansahEdria/statuses/1189123181195325440","2019-10-29 06:13:53","HerlyansahEdria","@bangzul_88 @LuwitaEmilly878 @prabowo @mohmahfudmd @Kemenag_RI @PolhukamRI Sepertinya Ormas2 &amp; Okp memang mengganggu rakyat,,,,, banyak melencengnya dari kesejahteraan negara,,,,, menjahati &amp; menduiti perusahaan saja yg banyak pengurus2nya,,,,, pabrik &amp; perusahaan bagusnya menambahkan gaji upah karyawannya dari pada bayar ngasih2 bulanan ke ormas &amp; okp","@bangzul_88 @LuwitaEmilly878 @prabowo @mohmahfudmd @Kemenag_RI @PolhukamRI Sepertinya Ormas2 &amp; Okp memang mengganggu rakyat,,,,, banyak melencengnya dari kesejahteraan negara,,,,, menjahati &amp; menduiti perusahaan saja yg banyak pengurus2nya,,,,, pabrik &amp; perusahaan bagusnya menambahkan gaji upah karyawannya dari pada bayar ngasih2 bulanan ke ormas &amp; okp","Twitter for Android",1168224592516640768,"https://pbs.twimg.com/profile_images/1186855532243456001/FCtU49_P_normal.jpg",217,51,50,"2019-09-01 14:11:00","Sejahtera","Indonesia","in","","","","","","","","","","","","","","","","","","",
244,"https://twitter.com/rang_simabua/statuses/1189123110714277888","https://twitter.com/rang_simabua/statuses/1189123110714277888","2019-10-29 06:13:37","rang_simabua","RT @DheaMerlinda: Pak Menhan @prabowo  Beginilah sifat beliau yg sebenarnya. Merangkul bkn memukul. Menyapa bkn menghina. https://t.co/mQhb…","Pak Menhan @prabowo  Beginilah sifat beliau yg sebenarnya. Merangkul bkn memukul. Menyapa bkn menghina. https://t.co/mQhbRQbRGk","Twitter for Android",1331112764,"https://pbs.twimg.com/profile_images/3483856220/1335046afe134df3cd60456327080cf5_normal.jpeg",47240,2618,6833,"2013-04-06 05:00:30","| Mantan Ketua RT |","Indonesia","in","","","","","","","","","","","","","","","","","","",
245,"https://twitter.com/cara14cheer/statuses/1189123059631804417","https://twitter.com/cara14cheer/statuses/1189123059631804417","2019-10-29 06:13:24","cara14cheer","RT @RizmaWidiono: Prabowo: Saya Mengutuk Radikalisme, Tidak Boleh Ada di Indonesia  Teriaknya kudu lebih kenceng Jenderal, biar kedengeran…","Prabowo: Saya Mengutuk Radikalisme, Tidak Boleh Ada di Indonesia  Teriaknya kudu lebih kenceng Jenderal, biar kedengeran sama pendukung bapak.! Selamat bertugas Pak @prabowo 🙏🏻  #RadikalKepanasan  https://t.co/EC8vtWBmaW","Twitter for Android",66099997,"https://pbs.twimg.com/profile_images/1155401349472772096/3x0Q_wKV_normal.jpg",23003,489,498,"2009-08-16 07:23:24","","Kupang","in","","","","","","","","","","","","","","","","","","",
246,"https://twitter.com/galihindrawands/statuses/1189122968779014144","https://twitter.com/galihindrawands/statuses/1189122968779014144","2019-10-29 06:13:03","galihindrawands","@ragiliman2 @NongNayara @prabowo Lu kan juga disini sebagai netizen BANGSAT !!!","@ragiliman2 @NongNayara @prabowo Lu kan juga disini sebagai netizen BANGSAT !!!","Twitter for Android",1109029749089722368,"https://pbs.twimg.com/profile_images/1109030003478401024/H7JUG0NO_normal.jpg",84,31,6,"2019-03-22 05:51:11","nikmati alur cerita hidupmu meski pahit ,karena kopi pun tak akan terasa nikmat jika tak ada rasa pahit di dalamnya","Bogor, Jawa Barat","in","","","","","","","","","","","","","","","","","","",
247,"https://twitter.com/DanielSentanu/statuses/1189122957429264385","https://twitter.com/DanielSentanu/statuses/1189122957429264385","2019-10-29 06:13:00","DanielSentanu","RT @conan_idn: Cc Pak Menhan @prabowo mohon dibebaskan anak negeri karena perjuangan Politik.. Tahanan Politik Bebaskanlah.. https://t.co/S…","Cc Pak Menhan @prabowo mohon dibebaskan anak negeri karena perjuangan Politik.. Tahanan Politik Bebaskanlah.. https://t.co/SlxCcpQyVO","Twitter for Android",951655388683923456,"https://pbs.twimg.com/profile_images/1188192282211581952/xwgb8dVY_normal.jpg",5362,246,146,"2018-01-11 22:21:40","Warga Negara Indonesia","Kota Yogyakarta, Yogyakarta","in","","","","","","","","","","","","","","","","","","",
248,"https://twitter.com/TsTsp71/statuses/1189122908645285889","https://twitter.com/TsTsp71/statuses/1189122908645285889","2019-10-29 06:12:48","TsTsp71","RT @Gerindra: Kenapa Menhan @prabowo Ngantor Tak Pakai Mobil Dinas? https://t.co/z8qfCQwT3w","Kenapa Menhan @prabowo Ngantor Tak Pakai Mobil Dinas? https://t.co/z8qfCQwT3w","Twitter for Android",1664608862,"https://pbs.twimg.com/profile_images/1106005985015914496/Ch9D7_je_normal.jpg",88687,802,556,"2013-08-12 05:13:32","","","in","","","","","","","","","","","","","","","","","","",
249,"https://twitter.com/jatmikoWwidodo/statuses/1189122881034129408","https://twitter.com/jatmikoWwidodo/statuses/1189122881034129408","2019-10-29 06:12:42","jatmikoWwidodo","RT @bangzul_88: Mantappppp... Ribuan Laskar Ronggolawe Bersiap Bubarkan Musda FPI di Tegal  Cc @prabowo @mohmahfudmd @Kemenag_RI @PolhukamR…","Mantappppp... Ribuan Laskar Ronggolawe Bersiap Bubarkan Musda FPI di Tegal  Cc @prabowo @mohmahfudmd @Kemenag_RI @PolhukamRI Giliran pemerintah kami tunggu!! #RadikalKepanasan https://t.co/96ZuwnCJ7B","Twitter Web App",730409161796685824,"https://pbs.twimg.com/profile_images/734313791337308160/8iGYbCUj_normal.jpg",16090,531,220,"2016-05-11 10:48:09","Terbang ke awan","Indonesia","in","","","","","","","","","","","","","","","","","","",
250,"https://twitter.com/Tasya37801553/statuses/1189122744966713344","https://twitter.com/Tasya37801553/statuses/1189122744966713344","2019-10-29 06:12:09","Tasya37801553","RT @bangzul_88: Mantappppp... Ribuan Laskar Ronggolawe Bersiap Bubarkan Musda FPI di Tegal  Cc @prabowo @mohmahfudmd @Kemenag_RI @PolhukamR…","Mantappppp... Ribuan Laskar Ronggolawe Bersiap Bubarkan Musda FPI di Tegal  Cc @prabowo @mohmahfudmd @Kemenag_RI @PolhukamRI Giliran pemerintah kami tunggu!! #RadikalKepanasan https://t.co/96ZuwnCJ7B","Twitter for Android",923357134686887936,"https://pbs.twimg.com/profile_images/1065203407244341248/THoQqmG3_normal.jpg",2991,358,91,"2017-10-25 21:14:30","","Majalengka, Indonesia","in","","","","","","","","","","","","","","","","","","",
251,"https://twitter.com/DjideAmri/statuses/1189122726327275521","https://twitter.com/DjideAmri/statuses/1189122726327275521","2019-10-29 06:12:05","DjideAmri","RT @DheaMerlinda: Pak Menhan @prabowo  Beginilah sifat beliau yg sebenarnya. Merangkul bkn memukul. Menyapa bkn menghina. https://t.co/mQhb…","Pak Menhan @prabowo  Beginilah sifat beliau yg sebenarnya. Merangkul bkn memukul. Menyapa bkn menghina. https://t.co/mQhbRQbRGk","Twitter for Android",1158306694218186752,"https://pbs.twimg.com/profile_images/1158306889534332928/RT7vcpp7_normal.jpg",195,177,6,"2019-08-05 05:20:10","Muh. Yahya Maulana UliL","","in","","","","","","","","","","","","","","","","","","",
252,"https://twitter.com/hifzankoto/statuses/1189122677870481408","https://twitter.com/hifzankoto/statuses/1189122677870481408","2019-10-29 06:11:53","hifzankoto","@bangzul_88 @jokowi @Puspen_TNI @DivHumas_Polri @prabowo @mohmahfudmd @erickthohir klu ngak suka jgn di viralin, gt aja ko repot","@bangzul_88 @jokowi @Puspen_TNI @DivHumas_Polri @prabowo @mohmahfudmd @erickthohir klu ngak suka jgn di viralin, gt aja ko repot","Twitter for Android",149590069,"https://pbs.twimg.com/profile_images/1134331298162495489/_QUoydJH_normal.png",628,160,167,"2010-05-29 13:41:11","Tdk ada ""kebencian melebihi soal bisnis"". Bukan agama, bukan suku, & bukan bangsa: BISNIS","Swerd The Lovely City","in","","","","","","","","","","","","","","","","","","",
253,"https://twitter.com/Jeffrie_rhs/statuses/1189122646182522882","https://twitter.com/Jeffrie_rhs/statuses/1189122646182522882","2019-10-29 06:11:46","Jeffrie_rhs","RT @JKDaulay: ""Amien Rais mengatakan dirinya tak memberi restu kepada Prabowo untuk menjadi Menhan di kabinet Presiden Jokowi."" https://t.c…","""Amien Rais mengatakan dirinya tak memberi restu kepada Prabowo untuk menjadi Menhan di kabinet Presiden Jokowi."" https://t.co/nsmvaXoVj1  direstui atau tidak, gak ada urusan sama Amien Rais. ini bukan akad nikah ! dan dia... bukan walinya @prabowo !  #RadikalKepanasan 🔥","Twitter for Android",2749066816,"https://pbs.twimg.com/profile_images/1174912389860352000/pJemMWYP_normal.jpg",8287,842,806,"2014-08-21 08:36:36","First Things First","AMBONNES","in","","","","","","","","","","","","","","","","","","",
254,"https://twitter.com/MasCEPUK/statuses/1189122646056660992","https://twitter.com/MasCEPUK/statuses/1189122646056660992","2019-10-29 06:11:46","MasCEPUK","RT @RizmaWidiono: Prabowo: Saya Mengutuk Radikalisme, Tidak Boleh Ada di Indonesia  Teriaknya kudu lebih kenceng Jenderal, biar kedengeran…","Prabowo: Saya Mengutuk Radikalisme, Tidak Boleh Ada di Indonesia  Teriaknya kudu lebih kenceng Jenderal, biar kedengeran sama pendukung bapak.! Selamat bertugas Pak @prabowo 🙏🏻  #RadikalKepanasan  https://t.co/EC8vtWBmaW","Twitter for Android",83451014,"https://pbs.twimg.com/profile_images/1185990487829708800/reIK6jMO_normal.jpg",43539,1251,2382,"2009-10-18 17:29:23","SANTRI MBELING WANI TANDING - PAGAR NUSA.                                                 NKRI HARGA MATI.","Sragen, Indonesia","in","","","","","","","","","","","","","","","","","","",
255,"https://twitter.com/sari00925317/statuses/1189122628872634368","https://twitter.com/sari00925317/statuses/1189122628872634368","2019-10-29 06:11:42","sari00925317","@Kata_Hatiku88 @Kemhan_RI @prabowo @univ_pertahanan Tau tuh. Menhan yg dulu² gak pakai wamen, kenapa giliran Pak Prabowo masuk yg jdi menhan jdi ada wamennya","@Kata_Hatiku88 @Kemhan_RI @prabowo @univ_pertahanan Tau tuh. Menhan yg dulu² gak pakai wamen, kenapa giliran Pak Prabowo masuk yg jdi menhan jdi ada wamennya","Twitter for Android",983007432862412800,"https://pbs.twimg.com/profile_images/1142428545160863744/A2gFchNB_normal.jpg",8954,526,518,"2018-04-08 11:43:30","","","in","","","","","","","","","","","","","","","","","","",
256,"https://twitter.com/Dewidaffa8/statuses/1189122624766349312","https://twitter.com/Dewidaffa8/statuses/1189122624766349312","2019-10-29 06:11:41","Dewidaffa8","@alysap_ @detikcom @prabowo @aniesbaswedan Ishhh ishhh rasisnya kampungan kali","@alysap_ @detikcom @prabowo @aniesbaswedan Ishhh ishhh rasisnya kampungan kali","Twitter for Android",1141369700988755969,"https://pbs.twimg.com/profile_images/1141898319859310593/9T6aPAAR_normal.jpg",56,16,0,"2019-06-19 11:38:37","berduaan suami","","in","","","","","","","","","","","","","","","","","","",
257,"https://twitter.com/SuwarnoCr/statuses/1189122594722598912","https://twitter.com/SuwarnoCr/statuses/1189122594722598912","2019-10-29 06:11:34","SuwarnoCr","RT @RizmaWidiono: Prabowo: Saya Mengutuk Radikalisme, Tidak Boleh Ada di Indonesia  Teriaknya kudu lebih kenceng Jenderal, biar kedengeran…","Prabowo: Saya Mengutuk Radikalisme, Tidak Boleh Ada di Indonesia  Teriaknya kudu lebih kenceng Jenderal, biar kedengeran sama pendukung bapak.! Selamat bertugas Pak @prabowo 🙏🏻  #RadikalKepanasan  https://t.co/EC8vtWBmaW","Twitter for Android",516548975,"https://pbs.twimg.com/profile_images/1134761636147843072/IFJ8BUqc_normal.jpg",4387,189,40,"2012-03-06 09:04:24","life is simple, don\'t make it hard.","","in","","","","","","","","","","","","","","","","","","",
258,"https://twitter.com/ranggapoejangga/statuses/1189122583221788672","https://twitter.com/ranggapoejangga/statuses/1189122583221788672","2019-10-29 06:11:31","ranggapoejangga","RT @bangzul_88: Mantappppp... Ribuan Laskar Ronggolawe Bersiap Bubarkan Musda FPI di Tegal  Cc @prabowo @mohmahfudmd @Kemenag_RI @PolhukamR…","Mantappppp... Ribuan Laskar Ronggolawe Bersiap Bubarkan Musda FPI di Tegal  Cc @prabowo @mohmahfudmd @Kemenag_RI @PolhukamRI Giliran pemerintah kami tunggu!! #RadikalKepanasan https://t.co/96ZuwnCJ7B","Twitter Web App",82045452,"https://pbs.twimg.com/profile_images/1081481034883944448/cgbxVOVF_normal.jpg",29537,400,256,"2009-10-13 04:27:46","IKHLAS bukanlah hal yang mudah,tetapi mencobanya adalah hal yang paling bijaksana dalam mengatasi problema hidup,...","Condet","in","","","","","","","","","","","","","","","","","","",
259,"https://twitter.com/afiframadhann/statuses/1189122569682616320","https://twitter.com/afiframadhann/statuses/1189122569682616320","2019-10-29 06:11:28","afiframadhann","RT @KATADATAcoid: Menhan @prabowo sudah bersilaturahmi dengan perwakilan AS seusai dilantik dan sudah diundang untuk berkunjung ke AS. http…","Menhan @prabowo sudah bersilaturahmi dengan perwakilan AS seusai dilantik dan sudah diundang untuk berkunjung ke AS. https://t.co/CIjtNxrwWG","Twitter for Android",303051435,"https://pbs.twimg.com/profile_images/1169993832328355841/LbHg7_kn_normal.jpg",6465,499,299,"2011-05-22 02:53:09","Sedang Belajar Sekarang IG : @kebuli_sulthan","THE EARTH","in","","","","","","","","","","","","","","","","","","",
260,"https://twitter.com/lelakimu1818/statuses/1189122510521942016","https://twitter.com/lelakimu1818/statuses/1189122510521942016","2019-10-29 06:11:13","lelakimu1818","@JKDaulay @prabowo Pak tua satu ini badannya kecil..partainya jg partai kecil(tp merasa besar)  Tapi bacotnya gede..","@JKDaulay @prabowo Pak tua satu ini badannya kecil..partainya jg partai kecil(tp merasa besar)  Tapi bacotnya gede..","Twitter for Android",953488807025827840,"https://pbs.twimg.com/profile_images/1177780516902207488/cUgikoX5_normal.jpg",18020,1021,506,"2018-01-16 23:47:01","i never lose..i either win.....or i learn | great navigator | daddys | leaders","Jakarta Pusat, DKI Jakarta","in","","","","","","","","","","","","","","","","","","",
261,"https://twitter.com/abimanyu_daffa/statuses/1189122510500986880","https://twitter.com/abimanyu_daffa/statuses/1189122510500986880","2019-10-29 06:11:13","abimanyu_daffa","Dari slof @prabowo kena dewan menteri @jokowi | bengkarung tanah makin persoalan merusak Negara Kesatuan Republik Indonesia melanggar tuba khilafah ISIS mereka #RadikalKepanasan #RadikalKepanasan","Dari slof @prabowo kena dewan menteri @jokowi | bengkarung tanah makin persoalan merusak Negara Kesatuan Republik Indonesia melanggar tuba khilafah ISIS mereka #RadikalKepanasan #RadikalKepanasan","Tween",940066215271075843,"https://pbs.twimg.com/profile_images/1164842122962337793/uDZ9Lsh8_normal.jpg",91,85,39,"2017-12-10 22:50:26","skate in the flow cloud","Semarang","in","","","","","","","","","","","","","","","","","","",
262,"https://twitter.com/Abdi_Rhm/statuses/1189122465294733312","https://twitter.com/Abdi_Rhm/statuses/1189122465294733312","2019-10-29 06:11:03","Abdi_Rhm","@wisma_rini @Kemhan_RI @prabowo @univ_pertahanan Gw gak like karna ada wamennya","@wisma_rini @Kemhan_RI @prabowo @univ_pertahanan Gw gak like karna ada wamennya","Twitter for Android",1454302794,"https://pbs.twimg.com/profile_images/1092249495880925184/vq2-Q7pf_normal.jpg",8854,1818,1866,"2013-05-24 10:08:35","Cinta Damai","","in","","","","","","","","","","","","","","","","","","",
263,"https://twitter.com/bajang15846/statuses/1189122275443740673","https://twitter.com/bajang15846/statuses/1189122275443740673","2019-10-29 06:10:17","bajang15846","RT @DheaMerlinda: Pak @prabowo tdk memakai fasilitas Negara.Gaji sebagai Menhan tdk d ambil. seperti kata Gus Dur : org yg Ikhlas utk Negar…","Pak @prabowo tdk memakai fasilitas Negara.Gaji sebagai Menhan tdk d ambil. seperti kata Gus Dur : org yg Ikhlas utk Negara ini ya Prabowo. https://t.co/aZVr3tYG0c","Twitter for Android",3847816998,"https://pbs.twimg.com/profile_images/1123073424794865664/o3909npr_normal.jpg",106,73,8,"2015-10-10 09:37:19","","","in","","","","","","","","","","","","","","","","","","",
264,"https://twitter.com/MidoriYuni/statuses/1189122272625192960","https://twitter.com/MidoriYuni/statuses/1189122272625192960","2019-10-29 06:10:17","MidoriYuni","@Anisa_Segaf @prabowo Allah sll melindungi Pak prabowo","@Anisa_Segaf @prabowo Allah sll melindungi Pak prabowo","Twitter for Android",1131130717264474112,"https://pbs.twimg.com/profile_images/1131131459018735616/cmBRI3yl_normal.jpg",11,12,2,"2019-05-22 05:32:33","Macan","","in","","","","","","","","","","","","","","","","","","",
265,"https://twitter.com/DewiIsnaini18/statuses/1189122257068494848","https://twitter.com/DewiIsnaini18/statuses/1189122257068494848","2019-10-29 06:10:13","DewiIsnaini18","RT @Kata_Hatiku88: Pesan Dari Bapak @prabowo Nich Khususnya Untuk Anak-Anak Muda Indonesia.....""  👉Klo kamu tidak bisa Berbuat Banyak Berbu…","Pesan Dari Bapak @prabowo Nich Khususnya Untuk Anak-Anak Muda Indonesia.....""  👉Klo kamu tidak bisa Berbuat Banyak Berbuat Sedikit, Klo tidak Bisa Berbuat Sedikit\'pun JANGAN BERBUAT RUSAK !!!!"" https://t.co/yffIkW6AMc","Twitter for Android",917357433147625473,"https://pbs.twimg.com/profile_images/1179729656527736833/oTfxnrOI_normal.jpg",981,1230,834,"2017-10-09 07:53:50","Alhmdulillah","","in","","","","","","","","","","","","","","","","","","",
266,"https://twitter.com/Alfaris25164390/statuses/1189122169902489601","https://twitter.com/Alfaris25164390/statuses/1189122169902489601","2019-10-29 06:09:52","Alfaris25164390","@Princes288 Cc @prabowo Cc @BangJapar_FI","@Princes288 Cc @prabowo Cc @BangJapar_FI","Twitter for Android",1122974125742383104,"https://pbs.twimg.com/profile_images/1188110085190324224/hfRAf2Ng_normal.jpg",1394,178,89,"2019-04-29 17:21:10","Karena hidup hanya sekali,maka jadikan hidup lebih berarti.","Gunung Putri, Indonesia","cy","","","","","","","","","","","","","","","","","","",
267,"https://twitter.com/_saskia_luna_/statuses/1189122140559118336","https://twitter.com/_saskia_luna_/statuses/1189122140559118336","2019-10-29 06:09:45","_saskia_luna_","sejak slof @prabowo hadir lemari (kecil) @jokowi | bengkarung padang pasir makin kepelikan merusak Negara Kesatuan Republik Indonesia v arsenik khilafah ISIS mereka #RadikalKepanasan #RadikalKepanasan","sejak slof @prabowo hadir lemari (kecil) @jokowi | bengkarung padang pasir makin kepelikan merusak Negara Kesatuan Republik Indonesia v arsenik khilafah ISIS mereka #RadikalKepanasan #RadikalKepanasan","Echofon",925215848498737152,"https://pbs.twimg.com/profile_images/1164805804249116672/6GIlGLd__normal.jpg",58,33,24,"2017-10-31 00:20:22","K I A","Bali, Indonesia","in","","","","","","","","","","","","","","","","","","",
268,"https://twitter.com/ngonlain/statuses/1189122119117897728","https://twitter.com/ngonlain/statuses/1189122119117897728","2019-10-29 06:09:40","ngonlain","RT @BuednextRama: @GrandisJavaSia @Jelantik5 @DivHumas_Polri @KomnasHAM @KPAI_official Cc @mohmahfudmd @DivHumas_Polri @Kemenag_RI @Kemenda…","@GrandisJavaSia @Jelantik5 @DivHumas_Polri @KomnasHAM @KPAI_official Cc @mohmahfudmd @DivHumas_Polri @Kemenag_RI @Kemendagri_RI @kemendagri  @prabowo @ridwankamil @jokowi @","Twitter for Android",919743265380765696,"https://pbs.twimg.com/profile_images/1186025634058756098/yMokBHL3_normal.jpg",114668,342,560,"2017-10-15 21:54:17","#KamiBersamaJokowiMarufAmin nyang sedang ngonlain ,,, sehat dan warasnya ,,, sedang #SayaBersamaJokowiMarufAmin barengin","","und","","","","","","","","","","","","","","","","","","",
269,"https://twitter.com/VanOriginal1/statuses/1189121979187523585","https://twitter.com/VanOriginal1/statuses/1189121979187523585","2019-10-29 06:09:07","VanOriginal1","RT @DheaMerlinda: Pak Menhan @prabowo  Beginilah sifat beliau yg sebenarnya. Merangkul bkn memukul. Menyapa bkn menghina. https://t.co/mQhb…","Pak Menhan @prabowo  Beginilah sifat beliau yg sebenarnya. Merangkul bkn memukul. Menyapa bkn menghina. https://t.co/mQhbRQbRGk","Twitter for Android",1118538279681282048,"https://pbs.twimg.com/profile_images/1145168255243309056/TAiXtDXc_normal.jpg",2501,294,248,"2019-04-17 11:34:42","Laa tahzan inallaha ma\'ana","","in","","","","","","","","","","","","","","","","","","",
270,"https://twitter.com/frida_rahardjo/statuses/1189121945616318464","https://twitter.com/frida_rahardjo/statuses/1189121945616318464","2019-10-29 06:08:59","frida_rahardjo","RT @r036_r: @RizmaWidiono @prabowo Mantap Jenderal....  #RadikalKepanasan","@RizmaWidiono @prabowo Mantap Jenderal....  #RadikalKepanasan","Twitter for Android",184162264,"https://pbs.twimg.com/profile_images/1116108576/IMG_4810_normal.JPG",191850,558,1085,"2010-08-28 17:22:11","☕️","","ht","","","","","","","","","","","","","","","","","","",
271,"https://twitter.com/MASHURI1966/statuses/1189121935310897152","https://twitter.com/MASHURI1966/statuses/1189121935310897152","2019-10-29 06:08:56","MASHURI1966","RT @RizmaWidiono: Prabowo: Saya Mengutuk Radikalisme, Tidak Boleh Ada di Indonesia  Teriaknya kudu lebih kenceng Jenderal, biar kedengeran…","Prabowo: Saya Mengutuk Radikalisme, Tidak Boleh Ada di Indonesia  Teriaknya kudu lebih kenceng Jenderal, biar kedengeran sama pendukung bapak.! Selamat bertugas Pak @prabowo 🙏🏻  #RadikalKepanasan  https://t.co/EC8vtWBmaW","Twitter for Android",901704552260321280,"https://pbs.twimg.com/profile_images/1184054844253818880/jAcffg47_normal.jpg",1979,260,68,"2017-08-27 03:14:52","Islam ""NUSANTARA "" NKRI,harga mati, SURO DIRHO JOYO NINGRAT LEBUR Dénèng""Pangastuti""","Malang, Jawa Timur","in","","","","","","","","","","","","","","","","","","",
